<!ELEMENT programe (program+)>

<!ELEMENT program ((titlu+), (program_link+), (image+), (text+), (review+))>
<!ATTLIST program id CDATA #REQUIRED>

<!ELEMENT titlu (#PCDATA)>
<!ELEMENT program_link (#PCDATA)>
<!ELEMENT image (#PCDATA)>
<!ELEMENT text (#PCDATA)>
<!ELEMENT review (#PCDATA)>